{
  "case_id": "F2-noisy",
  "run_id": "F2N-ADAPTIVE-P5-NATIVE1",
  "protocol_id": "adaptive-axes-v2",
  "materiality_contract_id": "baseline-delta-ledger-v1",
  "protocol_conformant": true,
  "audit_valid": true,
  "baseline": {
    "baseline_ref": "B0",
    "literal_initial_proposal": "Concerns sharing an axis and mechanism ID are duplicates."
  },
  "delta_candidates": [
    {
      "candidate_ref": "D1",
      "baseline_ref": "B0",
      "proposal_ref": "P0-input-key",
      "decision_surface": "key evaluation",
      "change_kind": "ADDITIVE",
      "classification": "NON_DECISION_RELEVANT",
      "precondition_provenance": "SUPPLIED_FACT",
      "supplied_behavior_change": false,
      "rationale": "P0 operationalizes B0's named fields with exact equality.",
      "peer_attestation": "NON_RELEVANT",
      "peer_attestation_basis": "The extra input fields do not independently alter disposition.",
      "finding_ref": null
    },
    {
      "candidate_ref": "D2",
      "baseline_ref": "B0",
      "proposal_ref": "P0-key-exclusion",
      "decision_surface": "duplicate disposition",
      "change_kind": "ADDITIVE",
      "classification": "UNCERTAIN",
      "precondition_provenance": "SUPPLIED_FACT",
      "supplied_behavior_change": false,
      "rationale": "P0 excludes revision and handler state while E2 supplies a changed handler under the same ID and E3 supplies no equivalence detail.",
      "peer_attestation": "UNRESOLVED",
      "peer_attestation_basis": "Non-relevance cannot be attested without behavioral-equivalence evidence.",
      "finding_ref": "F-A2A3-EQUIVALENCE-GAP"
    },
    {
      "candidate_ref": "D3",
      "baseline_ref": "B0",
      "proposal_ref": "P0-steps-1-2",
      "decision_surface": "concurrent processing",
      "change_kind": "ADDITIVE",
      "classification": "NON_DECISION_RELEVANT",
      "precondition_provenance": "SUPPLIED_FACT",
      "supplied_behavior_change": false,
      "rationale": "Atomic create-or-append makes B0's result race-safe.",
      "peer_attestation": "NON_RELEVANT",
      "peer_attestation_basis": "Atomicity does not change duplicate identity or disposition.",
      "finding_ref": null
    },
    {
      "candidate_ref": "D4",
      "baseline_ref": "B0",
      "proposal_ref": "P0-return-disposition",
      "decision_surface": "caller interface",
      "change_kind": "ADDITIVE",
      "classification": "NON_DECISION_RELEVANT",
      "precondition_provenance": "SUPPLIED_FACT",
      "supplied_behavior_change": false,
      "rationale": "ADMITTED and DUPLICATE externalize B0's result.",
      "peer_attestation": "NON_RELEVANT",
      "peer_attestation_basis": "The return vocabulary directly represents B0's two outcomes.",
      "finding_ref": null
    },
    {
      "candidate_ref": "D5",
      "baseline_ref": "B0",
      "proposal_ref": "P0-step-3",
      "decision_surface": "audit semantics",
      "change_kind": "ADDITIVE",
      "classification": "NON_DECISION_RELEVANT",
      "precondition_provenance": "SUPPLIED_FACT",
      "supplied_behavior_change": true,
      "rationale": "P0 adds immutable per-call observability without changing B0's key or disposition.",
      "peer_attestation": "NON_RELEVANT",
      "peer_attestation_basis": "The audit record changes observability only and retains every occurrence.",
      "finding_ref": null
    },
    {
      "candidate_ref": "D6",
      "baseline_ref": "B0",
      "proposal_ref": "P0-step-4",
      "decision_surface": "audit semantics",
      "change_kind": "ADDITIVE",
      "classification": "UNCERTAIN",
      "precondition_provenance": "SUPPLIED_FACT",
      "supplied_behavior_change": true,
      "rationale": "The mutation flag is guaranteed non-decisive, but E2 and E3 do not establish decision irrelevance.",
      "peer_attestation": "UNRESOLVED",
      "peer_attestation_basis": "An audit-only flag cannot establish semantic equivalence.",
      "finding_ref": "F-A2A3-EQUIVALENCE-GAP"
    },
    {
      "candidate_ref": "D7",
      "baseline_ref": "B0",
      "proposal_ref": "P0-signature",
      "decision_surface": "call boundary",
      "change_kind": "ADDITIVE",
      "classification": "NON_DECISION_RELEVANT",
      "precondition_provenance": "SUPPLIED_FACT",
      "supplied_behavior_change": true,
      "rationale": "P0 requires non-empty values for the identifiers needed to evaluate B0.",
      "peer_attestation": "NON_RELEVANT",
      "peer_attestation_basis": "The frozen chronology contains no empty-identifier event.",
      "finding_ref": null
    },
    {
      "candidate_ref": "D8",
      "baseline_ref": "B0",
      "proposal_ref": "P1-failure-handler-state",
      "decision_surface": "failure semantics",
      "change_kind": "CHANGED",
      "classification": "UNCERTAIN",
      "precondition_provenance": "SUPPLIED_FACT",
      "supplied_behavior_change": true,
      "rationale": "E2 supplies a handler change under a retained ID and E3 supplies no impact or equivalence detail.",
      "peer_attestation": "RELEVANT",
      "peer_attestation_basis": "The supplied mismatch triggers a decision-affecting pending-equivalence path.",
      "finding_ref": "F-A2A3-EQUIVALENCE-GAP"
    },
    {
      "candidate_ref": "D9",
      "baseline_ref": "B0",
      "proposal_ref": "P1-pending-equivalence-gate",
      "decision_surface": "finding admission",
      "change_kind": "ADDITIVE",
      "classification": "DECISION_RELEVANT",
      "precondition_provenance": "SUPPLIED_FACT",
      "supplied_behavior_change": true,
      "rationale": "P1 adds a separate persistent admission so unknown semantic impact is not suppressed by literal deduplication.",
      "peer_attestation": "RELEVANT",
      "peer_attestation_basis": "The exact E2 mismatch deterministically creates an actionable record distinct from the duplicate result.",
      "finding_ref": "F-A2A3-EQUIVALENCE-GAP"
    }
  ],
  "cycles_used": 1,
  "cycle_accounting": {
    "interactions": 3,
    "substantive_cycles": 1,
    "routed_findings": 1,
    "substantively_closed_findings": 1,
    "zero_cycle_eligible": false
  },
  "terminal_findings": [
    {
      "finding_ref": "F-A2A3-EQUIVALENCE-GAP",
      "candidate_ref": "D2",
      "provenance_origin": "BASELINE_DELTA",
      "baseline_ref": "B0",
      "proposal_ref": "P0-key-exclusion",
      "status": "RESOLVED",
      "axis": "revision effects / audit semantics",
      "mechanism": "axis-and-mechanism-ID deduplication with a non-decisive mutation flag",
      "precondition": "Two occurrences share axis and mechanism ID, have different handler states, and behavioral equivalence has not been verified.",
      "event": "The supplied P1 handler mutation is processed under the retained mechanism ID.",
      "observable_failure": "P0 returns DUPLICATE unconditionally and an audit-only flag cannot justify semantic safety.",
      "falsifier": "Verified behavioral equivalence of the old and new handlers for all decision-relevant failure semantics.",
      "first_observed_stage": "P0",
      "response_status": "unresolved",
      "response_basis": "No equivalence evidence was invented; P1 instead adds a separate persistent PENDING_EQUIVALENCE admission.",
      "peer_disposition": "modified",
      "peer_verification_basis": "For the exact E2 mismatch, P1 produces both the literal duplicate result and a distinct actionable pending record, so unknown impact is not silently suppressed."
    }
  ],
  "chief_disposition": "APPROVE",
  "limitations": [
    "Closed-world run; no behavior, impact, lifecycle, severity, or equivalence fact beyond E1-E3 was assumed.",
    "Downstream treatment and closure criteria for PENDING_EQUIVALENCE remain unspecified and therefore are a nonblocking limitation, not a supplied defect.",
    "Fresh separately instructed threads demonstrate observable execution isolation, not cognitive independence.",
    "The native task-level subagent path was used after separately recorded codex exec orchestration preflight failures; those empty runs are not counted as worker evidence."
  ]
}
